{
  "candidate": {
    "artifact_paths": [
      "power_mode_clamped_mux.va"
    ],
    "source_root": "./dut"
  },
  "deck": {
    "analyses": [
      "tran tran stop=16n maxstep=10p"
    ],
    "body_lines": [
      "Vvss (vss 0) vsource type=pwl wave=[0 0.03 4n 0.03 4.05n -0.06 8n -0.06 8.05n 0.02 12n 0.02 12.05n 0.05 14n 0.05 14.05n -0.08 16n -0.08]",
      "Vvdd (vdd 0) vsource type=pwl wave=[0 0.92 5n 0.92 5.05n 1.12 10n 1.12 10.05n 0.86 12n 0.86 12.05n 0.56 14n 0.56 14.05n 1.32 16n 1.32]",
      "Vin0 (in0 0) vsource type=pwl wave=[0 0.18 2n 0.18 2.05n 0.74 4n 0.74 4.05n 0.36 6n 0.36 6.05n 0.90 8n 0.90 8.05n 0.24 10n 0.24 10.05n 0.68 16n 0.68]",
      "Vin1 (in1 0) vsource type=pwl wave=[0 0.70 2n 0.70 2.05n 0.28 4n 0.28 4.05n 0.82 6n 0.82 6.05n 0.30 8n 0.30 8.05n 0.76 10n 0.76 10.05n 0.16 16n 0.16]",
      "Vin2 (in2 0) vsource type=pwl wave=[0 0.42 3n 0.42 3.05n 0.86 6n 0.86 6.05n 0.20 9n 0.20 9.05n 0.58 16n 0.58]",
      "Vin3 (in3 0) vsource type=pwl wave=[0 0.12 3n 0.12 3.05n 0.64 6n 0.64 6.05n 0.88 9n 0.88 9.05n 0.32 16n 0.32]",
      "Vctrl0 (ctrl0 0) vsource type=pwl wave=[0 0.0 3n 0.0 3.05n 0.9 6n 0.9 6.05n 0.0 9n 0.0 9.05n 0.9 16n 0.9]",
      "Vctrl1 (ctrl1 0) vsource type=pwl wave=[0 0.0 4.5n 0.0 4.55n 0.9 8n 0.9 8.05n 0.0 12n 0.0 12.05n 0.9 16n 0.9]",
      "Ven (en 0) vsource type=pwl wave=[0 0.9 5.8n 0.9 5.85n 0 7.1n 0 7.15n 0.9 12n 0.9]",
      "XDUT (in0 in1 in2 in3 ctrl0 ctrl1 vdd vss en out flag metric) power_mode_clamped_mux"
    ],
    "header": [
      "simulator lang=spectre",
      "global 0"
    ],
    "include_templates": [
      "ahdl_include \"{candidate_source_root}/{artifact_path}\""
    ],
    "save_signals": [
      "ctrl0",
      "ctrl1",
      "en",
      "flag",
      "in0",
      "in1",
      "in2",
      "in3",
      "metric",
      "out",
      "vdd",
      "vss"
    ]
  },
  "family_id": "253",
  "generator": {
    "name": "render_v4_harness.py",
    "version": "v4-harness-renderer-v1"
  },
  "migration": {
    "legacy_feedback_deck": "test_feedback/public_tb.scs",
    "legacy_feedback_deck_sha256": "380327b1d1f2213e96d097a03e17b453638ef37aa78fd3790160b2b6217996c6",
    "legacy_score_deck": "evaluator/score_tb.scs",
    "legacy_score_deck_sha256": "736045b74c0b1ecf6b3fdd6120b251688a833b1231be602447ab13ce06abc8b1",
    "notes": [
      "legacy feedback deck was used only to seed the canonical harness spec",
      "legacy score deck seeded private profile-specific overrides",
      "feedback deck is the canonical stimulus; score is generated with identical semantics"
    ]
  },
  "profile_defaults": {
    "feedback": {
      "simulatorOptions": {
        "evas_profile": "balanced"
      }
    },
    "score": {}
  },
  "property_ids": [
    "P_MEASURE_ANALOG_INPUTS_RELATIVE_TO_THE",
    "P_USE_THE_TWO_CONTROL_LEVELS_AS",
    "P_BUILD_A_VOLTAGE_DOMAIN_ANALOG_MIXED",
    "P_VTH_0_45_V_LOGIC_THRESHOLD",
    "P_VHI_0_9_V_HIGH_LEVEL",
    "P_SPAN_MIN_0_62_V_SPAN"
  ],
  "schema_version": "v4-harness-spec-v1",
  "source_contract": {
    "checker_profile_sha256": "e441f1dfa698264f215da32b789ec69359effcc8566e32180428d2860db3a979",
    "family_spec_sha256": "9f39e60427cabea339f974b898f49eb91d182d8f8ee6112019ea0cbff0524b45"
  },
  "task_id": "v4-253"
}
